{
  "$schema": "https://json-schema.org/draft/2020-12/schema",
  "$id": "https://dragonwarrior.org/schemas/v1/equipment.schema.json",
  "title": "EquipmentDataStoreV1",
  "description": "Schema for Quest: Warrior Dragon equipment (weapons, armor, shields), stat bonuses, costs, sell values, and special mechanics.",
  "type": "array",
  "items": {
    "type": "object",
    "title": "EquipmentItem",
    "properties": {
      "id": {
        "type": "string",
        "pattern": "^[a-z0-9_]+$",
        "description": "Unique equipment identifier."
      },
      "name": {
        "type": "string",
        "description": "Display name of equipment."
      },
      "type": {
        "$ref": "common.schema.json#/$defs/EquipmentType"
      },
      "attack": {
        "type": "integer",
        "minimum": 0,
        "description": "Attack power bonus (for weapons)."
      },
      "defense": {
        "type": "integer",
        "minimum": 0,
        "description": "Defense power bonus (for armor and shields)."
      },
      "cost": {
        "type": ["integer", "null"],
        "minimum": 0,
        "description": "Purchase cost in Gold (null if unpurchasable)."
      },
      "sold_in": {
        "type": "array",
        "items": { "type": "string" },
        "description": "Town locations where this item can be purchased."
      },
      "found_in": {
        "type": "string",
        "description": "Location name where this item is found as treasure."
      },
      "found_description": {
        "type": "string",
        "description": "Detailed description of how/where item is acquired."
      },
      "special": {
        "type": "string",
        "description": "Special effect description (e.g. HP regen per step, barrier immunity)."
      }
    },
    "required": ["id", "name", "type"]
  }
}
